extracción,articulo,precio,descripcion,grupo_web,tallas,colores,enlace,marca,grupo,seccion
2024-05-19 18:51:56.526669,FALDA MIDI SATINADA EFECTO ARRUGADO,25.95,Falda de tiro alto con cintura elástica. Detalle de tejido efecto arrugado.,V2024-MUJER-FALDAS-VER-TODO,"['XS', 'S', 'M', 'L', 'XL']",[],https://www.zara.com/es/es/falda-midi-satinada-efecto-arrugado-p09878068.html,ZARA,FALDA,MUJER
2024-05-19 18:51:56.526669,FALDA TUBO BOTONES DORADOS,29.95,Falda midi de tiro alto con detalle de falsos botones dorados delanteros. Bajo con abertura frontal. Cierre con cremallera oculta en costura.,V2024-MUJER-FALDAS-VER-TODO,"['XS', 'S', 'M', 'L', 'XL', 'XXL']",[],https://www.zara.com/es/es/falda-tubo-botones-dorados-p00387054.html,ZARA,FALDA,MUJER
2024-05-19 18:51:56.526669,FALDA PANTALÓN CINTURÓN CON LINO,25.95,Falda pantalón confeccionada con lino. Tiro alto con cinturón elástico a tono. Falsos bolsillos con solapa y botón en espalda. Bajo con abertura frontal. Cierre lateral con cremallera oculta en costura.,V2024-MUJER-FALDAS-VER-TODO,"['XS', 'S', 'M', 'L', 'XL']","['kaki-med', 'Tostado']",https://www.zara.com/es/es/falda-pantalon-cinturon-con-lino-p07969041.html,ZARA,FALDA,MUJER
2024-05-19 18:51:56.526669,FALDA PANTALÓN CRUZADA,22.95,Falda pantalón de tiro alto con delantero cruzado. Cierre lateral con cremallera oculta en costura.,V2024-MUJER-FALDAS-VER-TODO,"['XS', 'S', 'M', 'L', 'XL']","['Negro', 'Tostado', 'Blanco roto', 'Rosa pastel']",https://www.zara.com/es/es/falda-pantalon-cruzada-p01971229.html,ZARA,FALDA,MUJER
2024-05-19 18:51:56.526669,FALDA GLOBO COMBINADA,29.95,Falda midi de tiro medio con trabillas. Detalle de falso bolsillo en delantero. Tejido combinado a tono. Bajo acabado tipo globo.,V2024-MUJER-FALDAS-VER-TODO,"['XS', 'S', 'M', 'L', 'XL', 'XXL']",[],https://www.zara.com/es/es/falda-globo-combinada-p05520016.html,ZARA,FALDA,MUJER
2024-05-19 18:51:56.526669,FALDA Z1975 MIDI DENIM ABERTURA,25.95,Falda de tiro alto con cinco bolsillos. Efecto lavado. Bajo con abertura delantera y acabada sin costura. Cierre frontal con cremallera y botón metálico.,V2024-MUJER-FALDAS-VER-TODO,"['XS', 'S', 'M', 'L', 'XL']","['Azul medio', 'Azul claro']",https://www.zara.com/es/es/falda-z1975-midi-denim-abertura-p08228034.html,ZARA,FALDA,MUJER
2024-05-19 18:51:56.526669,FALDA CROCHET LENTEJUELAS,29.95,Falda midi de tiro alto con cintura elástica. Detalle aplicación lentejuelas. Bajo acabado sin costuras.,V2024-MUJER-FALDAS-VER-TODO,"['S', 'M', 'L']",[],https://www.zara.com/es/es/falda-crochet-lentejuelas-p01014340.html,ZARA,FALDA,MUJER
2024-05-19 18:51:56.526669,FALDA MINI GLOBO,19.95,Falda mini de tiro medio. Bajo acabado abullonado con volumen.,V2024-MUJER-FALDAS-VER-TODO,"['S', 'M', 'L']",[],https://www.zara.com/es/es/falda-mini-globo-p00085366.html,ZARA,FALDA,MUJER
2024-05-19 18:51:56.526669,FALDA MIDI SATINADA,25.95,Falda midi de tiro alto con cintura elástica.,V2024-MUJER-FALDAS-VER-TODO,"['XS', 'S', 'M', 'L', 'XL']","['Marino', 'Oliva', 'Visón', 'Crudo', 'Negro']",https://www.zara.com/es/es/falda-midi-satinada-p08534626.html,ZARA,FALDA,MUJER
2024-05-19 18:51:56.526669,FALDA Z1975 MIDI CRUZADA DENIM,25.95,Falda de tiro alto con bolsillos de plastrón en espalda. Bajo con abertura delantera. Cierre frontal cruzado con botones metálicos.,V2024-MUJER-FALDAS-VER-TODO,"['XS', 'S', 'M', 'L', 'XL']","['Gris', 'Azul medio']",https://www.zara.com/es/es/falda-z1975-midi-cruzada-denim-p01416021.html,ZARA,FALDA,MUJER
2024-05-19 18:51:56.526669,FALDA PANTALÓN BORDADA HOJAS,25.95,Falda pantalón de tiro alto con nudo en delantero. Cierre en espalda con cremallera oculta en costura.,V2024-MUJER-FALDAS-VER-TODO,"['XS', 'S', 'M', 'L', 'XL']",[],https://www.zara.com/es/es/falda-pantalon-bordada-hojas-p02157050.html,ZARA,FALDA,MUJER
2024-05-19 18:51:56.526669,FALDA PANTALÓN ESTAMPADA NUDO,25.95,Falda pantalón de tiro alto con nudo delantero. Cierre lateral con cremallera oculta en costura.,V2024-MUJER-FALDAS-VER-TODO,"['XS', 'S', 'M', 'L', 'XL']",[],https://www.zara.com/es/es/falda-pantalon-estampada-nudo-p02298021.html,ZARA,FALDA,MUJER
2024-05-19 18:51:56.526669,FALDA MIDI VOLUMEN ZW COLLECTION,29.95,ZARA WOMAN COLLECTIONFalda midi de tiro alto y cintura con elástico. Detalle de pliegues en cintura. Bajo acabado con volumen.,V2024-MUJER-FALDAS-VER-TODO,"['XS-S', 'M-L', 'XL-XXL']","['Negro', 'Rojo']",https://www.zara.com/es/es/falda-midi-volumen-zw-collection-p02731062.html,ZARA,FALDA,MUJER
2024-05-19 18:51:56.526669,FALDA CAPA ESTAMPADA,29.95,Falda con lazo delantero y cintura elástica en espalda. Bolsillos laterales ocultos en costura. Bajo en evasé.,V2024-MUJER-FALDAS-VER-TODO,"['XS', 'S', 'M', 'L', 'XL']",[],https://www.zara.com/es/es/falda-capa-estampada-p09878105.html,ZARA,FALDA,MUJER
2024-05-19 18:51:56.526669,FALDA PANTALÓN Z1975 DENIM CRUZADA,22.95,Falda pantalón de tiro alto con bolsillos delanteros y bolsillos de plastrón en espalda. Efecto lavado. Cierre frontal cruzado con cremallera oculta y botones metálicos.,V2024-MUJER-FALDAS-VER-TODO,"['XS', 'S', 'M', 'L', 'XL']","['Negro', 'Azul medio', 'Azul claro']",https://www.zara.com/es/es/falda-pantalon-z1975-denim-cruzada-p01416036.html,ZARA,FALDA,MUJER
2024-05-19 18:51:56.526669,FALDA PANTALÓN Z1975 DENIM CRUZADA BOTONES,22.95,Falda pantalón de tiro alto con bolsillos de plastrón en espalda. Cierre frontal con cremallera oculta y botones.,V2024-MUJER-FALDAS-VER-TODO,"['XS', 'S', 'M', 'L', 'XL']","['Khaki', 'Arena']",https://www.zara.com/es/es/falda-pantalon-z1975-denim-cruzada-botones-p08228039.html,ZARA,FALDA,MUJER
2024-05-19 18:51:56.526669,FALDA MINI ESTAMPADA PLISADA,25.95,Falda de tiro alto. Cinturón combinado a contraste con hebilla metálica. Cierre lateral con cremallera oculta en costura.,V2024-MUJER-FALDAS-VER-TODO,"['XS', 'S', 'M', 'L', 'XL']",[],https://www.zara.com/es/es/falda-mini-estampada-plisada-p09878095.html,ZARA,FALDA,MUJER
2024-05-19 18:51:56.526669,FALDA MINI PUNTO TABLAS,25.95,Falda de tiro alto con cintura elástica. Detalle de pliegues.,V2024-MUJER-FALDAS-VER-TODO,"['S', 'M', 'L', 'XL']","['Negro', 'Blanco', 'Azul claro']",https://www.zara.com/es/es/falda-mini-punto-tablas-p03859004.html,ZARA,FALDA,MUJER
2024-05-19 18:51:56.526669,FALDA LARGA ESTRUCTURA TUL,129.0,Falda de tiro alto con tejido combinado en estructura. Forro interior. Bajo en evasé. Cierre lateral con cremallera oculta en costura.,V2024-MUJER-FALDAS-VER-TODO,"['S', 'M', 'L']",[],https://www.zara.com/es/es/falda-larga-estructura-tul-p03920118.html,ZARA,FALDA,MUJER
2024-05-19 18:51:56.526669,FALDA ASIMÉTRICA ENCAJE,25.95,Falda semitransparente de tiro medio con cintura elástica. Bajo acabado asimétrico. Este articulo no incluye forro interior.,V2024-MUJER-FALDAS-VER-TODO,"['XS', 'S', 'M', 'L', 'XL', 'XXL']",[],https://www.zara.com/es/es/falda-asimetrica-encaje-p02180400.html,ZARA,FALDA,MUJER
2024-05-19 18:51:56.526669,FALDA MIDI ENCAJE BRILLOS,25.95,Falda midi de tiro alto con cintura elástica. Tejido con frunces y aplicación de brillos. Forro interior en tul a tono.,V2024-MUJER-FALDAS-VER-TODO,"['S', 'M', 'L']",[],https://www.zara.com/es/es/falda-midi-encaje-brillos-p04813305.html,ZARA,FALDA,MUJER
2024-05-19 18:52:25.148927,SHORTS FRUNCES ALGODÓN,22.95,Shorts de tiro alto confeccionados en algodón 100 %. Detalle de frunces y elásticos. Acabados en puntilla combinada a tono.,V2024-MUJER-SHORTS-SKORTS-VER-TODO,"['S', 'M', 'L']",[],https://www.zara.com/es/es/shorts-frunces-algodon-p07521802.html,ZARA,SHORTS,MUJER
2024-05-19 18:52:25.148927,SHORTS SATINADO CONTRASTE,22.95,Shorts de tiro medio con cintura elástica combinada a contraste ajustable con cordón interior. Bolsillos laterales ocultos en costura. Detalle de vivos combinados a contraste. Bajo con aberturas laterales.,V2024-MUJER-SHORTS-SKORTS-VER-TODO,"['XS', 'S', 'M', 'L', 'XL', 'XXL']","['Rojo vivo', 'Verde medio']",https://www.zara.com/es/es/shorts-satinado-contraste-p08338401.html,ZARA,SHORTS,MUJER
2024-05-19 18:52:25.148927,SHORTS POINTELLE,15.95,Shorts de tiro medio y cintura con elástico.,V2024-MUJER-SHORTS-SKORTS-VER-TODO,"['XS', 'S', 'M', 'L']",[],https://www.zara.com/es/es/shorts-pointelle-p01044166.html,ZARA,SHORTS,MUJER
2024-05-19 18:52:25.148927,BERMUDA PAREO SATINADA,49.95,Bermuda pareo confeccionada en hilatura de viscosa 100%. Tiro alto con cintura elástica en espalda. Bolsillo lateral de vivo. Detalle de tejido tipo pareo y cierre con corchete oculto.,V2024-MUJER-SHORTS-SKORTS-VER-TODO,"['XS', 'S', 'M', 'L', 'XL']",[],https://www.zara.com/es/es/bermuda-pareo-satinada-p09059041.html,ZARA,BERMUDA,MUJER
2024-05-19 18:52:25.148927,BERMUDA DENIM TRF MOM FIT TIRO ALTO,19.95,TIRO ALTO - RIGIDBermuda de tiro alto con cinco bolsillos. Bajo acabado en vuelta. Cierre frontal con cremallera y botón metálico.,V2024-MUJER-SHORTS-SKORTS-VER-TODO,"['32', '34', '36', '38', '40', '42', '44', '46']","['Azul claro', 'Negro', 'Blanco', 'Azul']",https://www.zara.com/es/es/bermuda-denim-trf-mom-fit-tiro-alto-p05520077.html,ZARA,BERMUDA,MUJER
2024-05-19 18:52:25.148927,FALDA PANTALÓN ESTRUCTURA BOTONES DORADOS,25.95,Falda pantalón de tiro alto con falsos botones dorados con relieve. Cierre lateral con cremallera oculta en costura.,V2024-MUJER-SHORTS-SKORTS-VER-TODO,"['XS', 'S', 'M', 'L', 'XL']",[],https://www.zara.com/es/es/falda-pantalon-estructura-botones-dorados-p03216339.html,ZARA,FALDA,MUJER
2024-05-19 18:52:25.148927,BERMUDA BORDADOS PERFORADOS ZW COLLECTION,29.95,ZARA WOMAN COLLECTIONBermuda de tiro alto confeccionada en hilatura de algodón 100%. Detalle de bordados perforados a tono. Forro interior. Cierre lateral con cremallera oculta en costura.,V2024-MUJER-SHORTS-SKORTS-VER-TODO,"['XS', 'S', 'M', 'L', 'XL']",[],https://www.zara.com/es/es/bermuda-bordados-perforados-zw-collection-p04786119.html,ZARA,BERMUDA,MUJER
2024-05-19 18:52:25.148927,BERMUDA BORDADOS ZW COLLECTION,29.95,ZARA WOMAN COLLECTIONBermuda de tiro alto confeccionada en hilatura con mezcla de viscosa y con lino 17%. Detalle de bordados combinados a tono. Cierre con cremallera oculta en costura.,V2024-MUJER-SHORTS-SKORTS-VER-TODO,"['XS', 'S', 'M', 'L', 'XL']",[],https://www.zara.com/es/es/bermuda-bordados-zw-collection-p02731079.html,ZARA,BERMUDA,MUJER
2024-05-19 18:52:25.148927,BERMUDA RAYAS POPELÍN,22.95,Bermuda confeccionada en hilatura de algodón 100%. Tiro medio y cintura elástica con lazada en mismo tejido. Bolsillos laterales ocultos en costura.,V2024-MUJER-SHORTS-SKORTS-VER-TODO,"['XS', 'S', 'M', 'L', 'XL']",[],https://www.zara.com/es/es/bermuda-rayas-popelin-p09081054.html,ZARA,BERMUDA,MUJER
2024-05-19 18:52:25.148927,BERMUDA DOBLE TELA TIRO ALTO,22.95,Bermuda de tiro alto con bolsillos delanteros de vivo. Cierre lateral con cremallera oculta en costura.,V2024-MUJER-SHORTS-SKORTS-VER-TODO,"['XS', 'S', 'M', 'L', 'XL', 'XXL']","['Negro', 'Blanco', 'Cobalto']",https://www.zara.com/es/es/bermuda-doble-tela-tiro-alto-p01478036.html,ZARA,BERMUDA,MUJER
2024-05-19 18:52:25.148927,FALDA PANTALÓN EFECTO BRILLO,25.95,Falda pantalón de tiro alto. Detalle de tejido efecto brillo. Falsos bolsillos de vivo en espalda. Cierre lateral con cremallera oculta en costura.,V2024-MUJER-SHORTS-SKORTS-VER-TODO,"['XS', 'S', 'M', 'L', 'XL', 'XXL']",[],https://www.zara.com/es/es/falda-pantalon-efecto-brillo-p03320567.html,ZARA,FALDA,MUJER
2024-05-19 18:52:25.148927,BERMUDA BORDADOS CONTRASTE ZW COLLECTION,29.95,ZARA WOMAN COLLECTIONBermuda de tiro alto confeccionada en hilatura con mezcla de viscosa y con lino 17%. Detalle de bordados combinados a contraste. Cierre con cremallera oculta en costura.,V2024-MUJER-SHORTS-SKORTS-VER-TODO,"['XS', 'S', 'M', 'L', 'XL']",[],https://www.zara.com/es/es/bermuda-bordados-contraste-zw-collection-p02731086.html,ZARA,BERMUDA,MUJER
2024-05-19 18:52:25.148927,BERMUDA ESTRUCTURA TIRO ALTO,25.95,Bermuda de tiro alto. Cierre frontal con cremallera y botón.,V2024-MUJER-SHORTS-SKORTS-VER-TODO,"['XS', 'S', 'M', 'L', 'XL']",[],https://www.zara.com/es/es/bermuda-estructura-tiro-alto-p07484030.html,ZARA,BERMUDA,MUJER
2024-05-19 18:52:25.148927,FALDA PANTALÓN NUDO BORDADOS PERFORADOS,25.95,Falda pantalón de tiro alto con nudo. Cierre lateral con cremallera oculta en costura.,V2024-MUJER-SHORTS-SKORTS-VER-TODO,"['XS', 'S', 'M', 'L', 'XL']",[],https://www.zara.com/es/es/falda-pantalon-nudo-bordados-perforados-p08073071.html,ZARA,FALDA,MUJER
2024-05-19 18:52:25.148927,SHORTS RAYAS EFECTO ARRUGADO,22.95,Shorts de tiro medio con cintura elástica. Bolsillos laterales y falsos bolsillos de vivo en espalda. Tejido efecto arrugado. Bajos con aberturas laterales con botones.,V2024-MUJER-SHORTS-SKORTS-VER-TODO,"['XS', 'S', 'M', 'L', 'XL', 'XXL']",[],https://www.zara.com/es/es/shorts-rayas-efecto-arrugado-p02180401.html,ZARA,SHORTS,MUJER
2024-05-19 18:52:25.148927,SHORTS RAYAS,22.95,Shorts de tiro medio con cintura elástica. Bolsillos en delantero. Bajo con aberturas laterales.,V2024-MUJER-SHORTS-SKORTS-VER-TODO,"['XS', 'S', 'M', 'L', 'XL', 'XXL']",[],https://www.zara.com/es/es/shorts-rayas-p06929419.html,ZARA,SHORTS,MUJER
2024-05-19 18:52:25.148927,BERMUDA TIRO ALTO HILO METALIZADO,25.95,"Bermuda de tiro alto con pinzas delanteras. Bolsillos frontales y falsos bolsillos de vivo en espalda. Cierre frontal con cremallera, botón interior y gancho.",V2024-MUJER-SHORTS-SKORTS-VER-TODO,"['XS', 'S', 'M', 'L', 'XL']",[],https://www.zara.com/es/es/bermuda-tiro-alto-hilo-metalizado-p03330340.html,ZARA,BERMUDA,MUJER
2024-05-19 18:52:25.148927,BERMUDA INTERLOCK,17.95,"Bermuda en tejido de punto elástico y flexible con trama compacta, mullida y opaca. Tiro medio y cintura elástica. Bolsillos laterales ocultos en costura.",V2024-MUJER-SHORTS-SKORTS-VER-TODO,"['XS', 'S', 'M', 'L', 'XL']","['Blanco', 'Negro', 'Rojo oscuro', 'Gris vigoré']",https://www.zara.com/es/es/bermuda-interlock-p03199002.html,ZARA,BERMUDA,MUJER
2024-05-19 18:52:25.148927,BERMUDA Z1975 BAGGY CINTURÓN,22.95,TIRO ALTO - BAGGYBermuda de tiro alto con frunces y cinturón. Bolsillos de plastrón en delantero y espalda. Cierre frontal con cremallera y botón.,V2024-MUJER-SHORTS-SKORTS-VER-TODO,"['32', '34', '36', '38', '40', '42', '44']","['Crudo', 'Azul medio', 'Azul']",https://www.zara.com/es/es/bermuda-z1975-baggy-cinturon-p08228040.html,ZARA,BERMUDA,MUJER
2024-05-19 18:53:00.269773,BLUSA COMBINADA CROCHET,49.95,Blusa de cuello solapa con cordones y borlas. Escote pico y manga larga. Detalle de tejido combinado en crochet.,V2024-MUJER-PUNTO-VER-TODO,"['S', 'M', 'L']",[],https://www.zara.com/es/es/blusa-combinada-crochet-p07200038.html,ZARA,BLUSA,MUJER
2024-05-19 18:53:00.269773,VESTIDO ESCOTE CRUZADO PUNTO,35.95,Vestido midi de escote cruzado.,V2024-MUJER-PUNTO-VER-TODO,"['S', 'M', 'L', 'XL']",[],https://www.zara.com/es/es/vestido-escote-cruzado-punto-p03519052.html,ZARA,VESTIDO,MUJER
2024-05-19 18:53:00.269773,TOP CROP PUNTO LISO,19.95,Top de cuello redondo y manga sisa. Bajo con abertura delantera. Cierre frontal con botones.,V2024-MUJER-PUNTO-VER-TODO,"['XS', 'S', 'M', 'L']","['Marino', 'Blanco']",https://www.zara.com/es/es/top-crop-punto-liso-p05536027.html,ZARA,TOP,MUJER
2024-05-19 18:53:00.269773,TOP PUNTO CROCHET,39.95,Top de punto calado con cuello redondo y manga corta.,V2024-MUJER-PUNTO-VER-TODO,"['S', 'M', 'L']",[],https://www.zara.com/es/es/top-punto-crochet-p07521036.html,ZARA,TOP,MUJER
2024-05-19 18:53:00.269773,CAMISA SEMITRANSPARENTE PUNTO PERLAS,29.95,Camisa de punto fino con cuello solapa y manga corta. Detalle aplicación de perlas. Cierre frontal con botones.Este artículo no incluye forro interior.,V2024-MUJER-PUNTO-VER-TODO,"['S-M', 'L-XL']",[],https://www.zara.com/es/es/camisa-semitransparente-punto-perlas-p03920304.html,ZARA,CAMISA,MUJER
2024-05-19 18:53:00.269773,JERSEY PUNTO LENTEJUELAS,29.95,Jersey de punto calado con cuello redondo amplio y manga larga. Detalle aplicación de lentejuelas.,V2024-MUJER-PUNTO-VER-TODO,"['S', 'M', 'L']",[],https://www.zara.com/es/es/jersey-punto-lentejuelas-p09874014.html,ZARA,JERSEY,MUJER
2024-05-19 18:53:00.269773,CHAQUETA PUNTO MANGA CORTA,29.95,Chaqueta de cuello redondo y manga corta. Cierre frontal con botones dorados con relieve.,V2024-MUJER-PUNTO-VER-TODO,"['S', 'M', 'L', 'XL']",[],https://www.zara.com/es/es/chaqueta-punto-manga-corta-p01822006.html,ZARA,CHAQUETA,MUJER
2024-05-19 18:53:00.269773,VESTIDO MINI PUNTO RAYAS,25.95,Vestido de escote pico y manga sisa.,V2024-MUJER-PUNTO-VER-TODO,"['XS', 'S', 'M', 'L', 'XL']",[],https://www.zara.com/es/es/vestido-mini-punto-rayas-p05802018.html,ZARA,VESTIDO,MUJER
2024-05-19 18:53:00.269773,JESERY PUNTO ABIERTO CON LANA LIMITED EDITION,39.95,Jersey confeccionado en hilatura con lana 38%. Cuello pico y manga larga. Detalle de aplicación de hilo metalizado a contraste. Acabados en rib.,V2024-MUJER-PUNTO-VER-TODO,"['S', 'M', 'L', 'XL']",[],https://www.zara.com/es/es/jesery-punto-abierto-con-lana-limited-edition-p05755017.html,ZARA,JESERY,MUJER
2024-05-19 18:53:00.269773,VESTIDO BANDEAU PUNTO JACQUARD,35.95,Vestido midi de escote recto con doble capa. Detalle de tejido con jacquard.,V2024-MUJER-PUNTO-VER-TODO,"['XS', 'S', 'M', 'L']",[],https://www.zara.com/es/es/vestido-bandeau-punto-jacquard-p05802017.html,ZARA,VESTIDO,MUJER
2024-05-19 18:53:00.269773,TOP PUNTO POINTELLE BOLAS,25.95,Top de escote y mangas asimétricas con aplicación de bolas.,V2024-MUJER-PUNTO-VER-TODO,"['S', 'M', 'L']",[],https://www.zara.com/es/es/top-punto-pointelle-bolas-p03920023.html,ZARA,TOP,MUJER
2024-05-19 18:53:00.269773,JERSEY PUNTO LISO CON LINO,35.95,Jersey confeccionado con lino. Cuello redondo y manga larga.,V2024-MUJER-PUNTO-VER-TODO,"['S', 'M', 'L']",[],https://www.zara.com/es/es/jersey-punto-liso-con-lino-p02142020.html,ZARA,JERSEY,MUJER
2024-05-19 18:53:00.269773,VESTIDO ASIMÉTRICO PUNTO CANALÉ,29.95,Vestido escote y tirante ancho asimétrico con nudo delantero.,V2024-MUJER-PUNTO-VER-TODO,"['XS', 'S', 'M', 'L']",[],https://www.zara.com/es/es/vestido-asimetrico-punto-canale-p04240002.html,ZARA,VESTIDO,MUJER
2024-05-19 18:53:00.269773,POLO PUNTO FINO BRILLOS,25.95,Polo de cuello solapa y manga por debajo del codo. Detalle de tejido semitransparente con brillos.,V2024-MUJER-PUNTO-VER-TODO,"['S', 'M', 'L', 'XL']",[],https://www.zara.com/es/es/polo-punto-fino-brillos-p02142067.html,ZARA,POLO,MUJER
2024-05-19 18:53:00.269773,VESTIDO MINI PUNTO PERLAS,35.95,Vestido de escote recto y tirantes anchos. Detalle aplicación de perlas.,V2024-MUJER-PUNTO-VER-TODO,"['XS', 'S', 'M', 'L']",[],https://www.zara.com/es/es/vestido-mini-punto-perlas-p02142076.html,ZARA,VESTIDO,MUJER
2024-05-19 18:53:00.269773,TOP POLO PUNTO ABALORIOS,39.95,Top estilo polo de cuello solapa y manga corta. Detalle aplicación de abalorios. Cierre frontal con botones.,V2024-MUJER-PUNTO-VER-TODO,"['S', 'M', 'L']",[],https://www.zara.com/es/es/top-polo-punto-abalorios-p03920063.html,ZARA,TOP,MUJER
2024-05-19 18:53:00.269773,VESTIDO MINI PUNTO LISO APLIQUE JOYA,49.95,Vestido de escote redondo con aplicación de joyas y manga sisa.,V2024-MUJER-PUNTO-VER-TODO,"['S', 'M', 'L', 'XL']",[],https://www.zara.com/es/es/vestido-mini-punto-liso-aplique-joya-p05755025.html,ZARA,VESTIDO,MUJER
2024-05-19 18:53:00.269773,CHAQUETA CROP PUNTO BOLAS,25.95,Chaqueta semitransparente de cuello redondo y manga larga. Detalle aplicación de bolas. Cierre frontal con botones.,V2024-MUJER-PUNTO-VER-TODO,"['XS', 'S', 'M', 'L']",[],https://www.zara.com/es/es/chaqueta-crop-punto-bolas-p03581001.html,ZARA,CHAQUETA,MUJER
2024-05-19 18:53:00.269773,CHAQUETA LARGA PUNTO,39.95,"Chaqueta abierta de punto calado. Manga larga con la sisa ancha, estrechándose hacia la muñeca.",V2024-MUJER-PUNTO-VER-TODO,"['S-M', 'L-XL']",[],https://www.zara.com/es/es/chaqueta-larga-punto-p09598126.html,ZARA,CHAQUETA,MUJER
2024-05-19 18:53:24.968813,SANDALIA  TACÓN TIRAS,29.95,"Zapato tipo sandalia tacón. Detalle de tiras finas en la parte delantera. Cierre mediante hebilla en la pulsera al tobillo. Altura del tacón: 4,5 cm.",V2024-MUJER-ZAPATOS-VER-TODO,"['35', '36', '37', '38', '39', '40', '41', '42']","['Rojo', 'Negro']",https://www.zara.com/es/es/sandalia-tacon-tiras-p11343310.html,ZARA,SANDALIA,MUJER
2024-05-19 18:53:24.968813,SANDALIA PLANA TIRAS TACHAS,39.95,Zapato tipo sandalia plana con tiras finas. Detalle de tachas de colores en las tiras. Cierre mediante tiras atadas al tobilloAltura de la suela:1 cm.,V2024-MUJER-ZAPATOS-VER-TODO,"['35', '36', '37', '38', '39', '40', '41', '42']",[],https://www.zara.com/es/es/sandalia-plana-tiras-tachas-p12631310.html,ZARA,SANDALIA,MUJER
2024-05-19 18:53:24.968813,SANDALIA PLANA PIEL ESTAMPADO ANIMAL,29.95,Zapato tipo sandalia plana de piel con pelo. Estampado animal. Tiras con posición para el dedo.Altura de la suela: 1 cm.,V2024-MUJER-ZAPATOS-VER-TODO,"['35', '36', '37', '38', '39', '40', '41', '42']",[],https://www.zara.com/es/es/sandalia-plana-piel-estampado-animal-p11673310.html,ZARA,SANDALIA,MUJER
2024-05-19 18:53:24.968813,SANDALIA PLANA  ADORNO,39.95,Zapato tipo sandalia plana con posición para el dedo. Detalle de tiras finas en la parte delantera con adorno metálico. Cierre mediante tiras atadas al tobilloAltura de la suela: 1 cm.,V2024-MUJER-ZAPATOS-VER-TODO,"['35', '36', '37', '38', '39', '40', '41', '42']",[],https://www.zara.com/es/es/sandalia-plana-adorno-p11646310.html,ZARA,SANDALIA,MUJER
2024-05-19 18:53:24.968813,SANDALIA PLANA PIEL,49.95,Zapato plano tipo sandalia en piel con posición para el dedo. Cierre mediante hebilla en la pulsera al tobillo.Altura de la suela: 2 cm.,V2024-MUJER-ZAPATOS-VER-TODO,"['35', '36', '37', '38', '39', '40', '41', '42']",[],https://www.zara.com/es/es/sandalia-plana-piel-p11656310.html,ZARA,SANDALIA,MUJER
2024-05-19 18:53:24.968813,SANDALIA PLANA BRILLOS,29.95,Zapato tipo sandalia plana con tiras finas con detalle de brillos. Posición para el dedo. Cierre mediante tiras de brillos atadas al tobillo.Altura de la suela: 1 cm.,V2024-MUJER-ZAPATOS-VER-TODO,"['35', '36', '37', '38', '39', '40', '41', '42']",[],https://www.zara.com/es/es/sandalia-plana-brillos-p13605410.html,ZARA,SANDALIA,MUJER
2024-05-19 18:53:24.968813,DEPORTIVO ABOTINADO,45.95,"Zapatillas deportivas abotinadas. Parte delantera y trasera en contraste. Cierre mediante cordones.Altura de la suela: 1,5 cm.",V2024-MUJER-ZAPATOS-VER-TODO,"['36', '37', '38', '39', '40', '41']",[],https://www.zara.com/es/es/deportivo-abotinado-p15833310.html,ZARA,DEPORTIVO,MUJER
2024-05-19 18:53:24.968813,SANDALIA PLANA PIEL,39.95,"Zapato tipo sandalia plana en piel. Con posición para el dedo. Cierre mediante tira adhesiva. Acabado en punta redonda.Altura de la suela: 1,5 cm.",V2024-MUJER-ZAPATOS-VER-TODO,"['35', '36', '37', '38', '39', '40', '41', '42']",[],https://www.zara.com/es/es/sandalia-plana-piel-p11643310.html,ZARA,SANDALIA,MUJER
2024-05-19 18:53:24.968813,ZAPATO DESTALONADO TACÓN LAZO,29.95,Zapato destalonado de tacón. Detalle de lazo en la parte delantera. Tira trasera con pieza elástica. Altura del tacón: 8 cm.,V2024-MUJER-ZAPATOS-VER-TODO,"['35', '36', '37', '38', '39', '40', '41', '42']",[],https://www.zara.com/es/es/zapato-destalonado-tacon-lazo-p12267310.html,ZARA,ZAPATO,MUJER
2024-05-19 18:53:24.968813,SANDALIA TACÓN PULSERA,35.95,Zapato tipo sandalia de tacón alto y fino. Cierre mediante hebilla en la pulsera del tobillo.Altura del tacón: 9 cm.,V2024-MUJER-ZAPATOS-VER-TODO,"['35', '36', '37', '38', '39', '40', '41', '42']",[],https://www.zara.com/es/es/sandalia-tacon-pulsera-p11310410.html,ZARA,SANDALIA,MUJER
2024-05-19 18:53:24.968813,SANDALIA TIRAS LAZO,29.95,Sandalia de tacón en tejido. Detalle de doble tira con lazo en la parte delantera. Altura del tacón: 8 cm.,V2024-MUJER-ZAPATOS-VER-TODO,"['35', '36', '37', '38', '39', '40', '41', '42']",[],https://www.zara.com/es/es/sandalia-tiras-lazo-p12338310.html,ZARA,SANDALIA,MUJER
2024-05-19 18:53:24.968813,BAILARINA TRENZADA DESTALONADA,27.95,"Zapato plano destalonado tipo bailarina. Detalle trenzado en el corte.Altura de la suela: 1,5 cm.",V2024-MUJER-ZAPATOS-VER-TODO,"['35', '36', '37', '38', '39', '40', '41', '42']",[],https://www.zara.com/es/es/bailarina-trenzada-destalonada-p13594310.html,ZARA,BAILARINA,MUJER
2024-05-19 18:53:24.968813,SANDALIA PLANA PIEL HEBILLA,35.95,Zapato tipo sandalia plana en piel. Detalle de tiras y hebilla en la parte delantera con posición para el dedo. Acabado en punta redonda.Altura de la suela: 1 cm.,V2024-MUJER-ZAPATOS-VER-TODO,"['35', '36', '37', '38', '39', '40', '41', '42']","['Rojo Burdeos', 'Verde']",https://www.zara.com/es/es/sandalia-plana-piel-hebilla-p11642310.html,ZARA,SANDALIA,MUJER
2024-05-19 18:53:24.968813,SANDALIA PLANA ADORNO,39.95,"Sandalia plana en tejido satinado con tiras finas. Posición para el dedo y detalle de adorno de brillos en la parte delantera. Cierre mediante hebilla en la pulsera del tobillo.Altura de la suela: 1,5 cm.",V2024-MUJER-ZAPATOS-VER-TODO,"['35', '36', '37', '38', '39', '40', '41', '42']",[],https://www.zara.com/es/es/sandalia-plana-adorno-p11655310.html,ZARA,SANDALIA,MUJER
2024-05-19 18:53:24.968813,SANDALIA PLANA ADORNO,27.95,"Zapato tipo sandalia plana en tejido con tiras finas. Posición para el dedo y detalle de adorno metálico.Altura de la suela: 1,5 cm.",V2024-MUJER-ZAPATOS-VER-TODO,"['35', '36', '37', '38', '39', '40', '41', '42']",[],https://www.zara.com/es/es/sandalia-plana-adorno-p11645310.html,ZARA,SANDALIA,MUJER
2024-05-19 18:53:24.968813,SANDALIA METALIZADA PLATAFORMA TACÓN,39.95,"Sandalia de tacón alto con plataforma. Efecto metalizado. Detalle de nudo en la parte delantera. Cierre mediante hebilla en la pulsera del tobillo. Altura del tacón: 10,4 cm.",V2024-MUJER-ZAPATOS-VER-TODO,"['35', '36', '37', '38', '39', '40', '41', '42']",[],https://www.zara.com/es/es/sandalia-metalizada-plataforma-tacon-p12319310.html,ZARA,SANDALIA,MUJER
