extracción,articulo,precio,descripcion,grupo_web,tallas,colores,enlace,marca,grupo,seccion
2024-05-19 18:44:42.537318,BLAZER TRAJE ESTRUCTURA,79.95,Blazer regular fit. Cuello con solapas de muesca y manga larga acabada en puño con botones. Bolsillo de vivo en pecho y de solapa en cadera. Detalle de bolsillo interior. Bajo con abertura en centro espalda. Cierre frontal con botonadura.,V2024-HOMBRE-BLAZERS-VER-TODO,"['46', '48', '50', '52', '54']",[],https://www.zara.com/es/es/blazer-traje-estructura-p04285291.html,ZARA,BLAZER,HOMBRE
2024-05-19 18:44:42.537318,BLAZER TRAJE ESTRUCTURA,69.95,Blazer slim fit. Cuello con solapas de muesca y manga larga acabada en puño con botones. Bolsillos de vivo en pecho y cadera. Detalle de bolsillo interior. Bajo con abertura central en espalda. Cierre frontal de botonadura.,V2024-HOMBRE-BLAZERS-VER-TODO,"['46', '48', '50', '52', '54']",[],https://www.zara.com/es/es/blazer-traje-estructura-p09989627.html,ZARA,BLAZER,HOMBRE
2024-05-19 18:44:42.537318,BLAZER PATA DE GALLO LINO - LANA,99.95,Blazer regular fit confeccionada en tejido de lino y lana. Cuello con solapas de muesca y manga larga acabada en puño con botones. Bolsillo de vivo en pecho y de plastrón en cadera. Detalle bolsillo interior. Bajo con aberturas en espalda. Cierre frontal de botonadura cruzada.,V2024-HOMBRE-BLAZERS-VER-TODO,"['46', '48', '50', '52', '54']",[],https://www.zara.com/es/es/blazer-pata-de-gallo-lino---lana-p05566310.html,ZARA,BLAZER,HOMBRE
2024-05-19 18:44:42.537318,BLAZER TRAJE VISCOSA - LINO,99.95,Blazer straight fit confeccionada en tejido con viscosa y lino. Cuello con solapas de muesca y manga larga acabada en puño con botones. Bolsillos de vivo en delantero y detalle de bolsillo interior. Bajo con abertura central en espalda. Cierre frontal de botonadura.,V2024-HOMBRE-BLAZERS-VER-TODO,"['46', '48', '50', '52', '54']",[],https://www.zara.com/es/es/blazer-traje-viscosa---lino-p04288636.html,ZARA,BLAZER,HOMBRE
2024-05-19 18:44:42.537318,BLAZER TRAJE ESTRUCTURA,79.95,Blazer straight fit. Cuello con solapas de muesca y manga larga acabada en puño con botones. Bolsillo de vivo en pecho y de solapa en cadera. Detalle de bolsillo interior. Bajo con aberturas en espalda. Cierre frontal de botonadura.,V2024-HOMBRE-BLAZERS-VER-TODO,"['46', '48', '50', '52', '54']",[],https://www.zara.com/es/es/blazer-traje-estructura-p01564420.html,ZARA,BLAZER,HOMBRE
2024-05-19 18:44:42.537318,BLAZER ESTRUCTURA CON LANA,109.0,Blazer confeccionada en tejido con lana. Cuello con solapas de pico y manga larga acabada en puño con botones. Bolsillos de vivo en pecho y de solapa en cadera. Detalle de bolsillo interior. Bajo con aberturas en espalda. Cierre frontal de botonadura cruzada.,V2024-HOMBRE-BLAZERS-VER-TODO,"['48', '50', '52', '54']",[],https://www.zara.com/es/es/blazer-estructura-con-lana-p04296310.html,ZARA,BLAZER,HOMBRE
2024-05-19 18:44:42.537318,BLAZER CON LANA CUADROS,89.95,Blazer straight fit confeccionada en tejido con lana. Cuello con solapas de muesca y manga larga acabada en puño con botones. Bolsillo de vivo en pecho y bolsillos de solapa en cadera. Detalle de bolsillo interior. Bajo con abertura central en espalda. Cierre frontal de botones forrados en el mismo tejido.,V2024-HOMBRE-BLAZERS-VER-TODO,"['46', '48', '50', '52', '54']",[],https://www.zara.com/es/es/blazer-con-lana-cuadros-p04321741.html,ZARA,BLAZER,HOMBRE
2024-05-19 18:44:42.537318,BLAZER TRAJE,99.95,Blazer straight fit confeccionada en tejido compacta con elasticidad. Cuello con solapas de muesca y manga larga acabada en puño con botones. Bolsillo de vivo en pecho y de solapa en cadera. Detalle de bolsillo interior. Bajo con aberturas en espalda. Cierre frontal de botonadura.,V2024-HOMBRE-BLAZERS-VER-TODO,"['46', '48', '50', '52']",[],https://www.zara.com/es/es/blazer-traje-p04303266.html,ZARA,BLAZER,HOMBRE
2024-05-19 18:45:21.614450,PANTALÓN CARGO,35.95,Pantalón regular fit confeccionado en tejido de algodón con estructura rústica. Cintura elástica ajustable con cordón interior. Bolsillos frontales y detalle de bolsillos traseros de plastrón. Bolsillos de plastrón en perneras. Cierre frontal con cremallera y botón.,V2024-HOMBRE-TOTAL-LOOK,"['S', 'M', 'L', 'XL']",[],https://www.zara.com/es/es/pantalon-cargo-p07147430.html,ZARA,PANTALÓN,HOMBRE
2024-05-19 18:45:21.614450,CAMISA POLO ABERTURA,39.95,Camisa relaxed fit confeccionada en tejido fluido de lyocell. Cuello solapa con abertura frontal. Manga larga.,V2024-HOMBRE-TOTAL-LOOK,"['S', 'M', 'L', 'XL']",[],https://www.zara.com/es/es/camisa-polo-abertura-p04724388.html,ZARA,CAMISA,HOMBRE
2024-05-19 18:45:21.614450,BERMUDA JOGGER COMPACT,22.95,Bermuda de cintura elástica ajustable con cordón. Bolsillos frontales y detalle de bolsillo en espalda.,V2024-HOMBRE-TOTAL-LOOK,"['S', 'M', 'L', 'XL']","['Negro', 'Blanco roto', 'Acero', 'Oliva', 'Verde agua', 'Grisáceo']",https://www.zara.com/es/es/bermuda-jogger-compact-p00761449.html,ZARA,BERMUDA,HOMBRE
2024-05-19 18:45:21.614450,PANTALÓN JOGGER BÁSICO,22.95,Pantalón de cintura elástica ajustable con cordón. Bolsillos frontales y detalle de bolsillo plastrón trasero. Bajo acabado en puño con elástico.,V2024-HOMBRE-TOTAL-LOOK,"['S', 'M', 'L', 'XL']","['Khaki oscuro', 'Gris antracita', 'Blanco roto', 'Gris vigoré', 'Negro', 'Tostado', 'Rojo', 'Verde']",https://www.zara.com/es/es/pantalon-jogger-basico-p00761352.html,ZARA,PANTALÓN,HOMBRE
2024-05-19 18:45:21.614450,CAMISA ESTRUCTURA BOLSILLOS,29.95,Camisa relaxed fit. Cuello solpa y manga corta. Bolsillo de plastrón en pecho. Cierre frontal de botonadura.,V2024-HOMBRE-TOTAL-LOOK,"['S', 'M', 'L', 'XL']",[],https://www.zara.com/es/es/camisa-estructura-bolsillos-p07147329.html,ZARA,CAMISA,HOMBRE
2024-05-19 18:45:21.614450,PANTALÓN WIDE FIT LYOCELL,39.95,Pantalón wide fit confeccionado en tejido fluido de lyocell. Cintura elástica ajustable con cordón. Bolsillos laterales y detalle de bolsillos traseros de vivo.,V2024-HOMBRE-TOTAL-LOOK,"['S', 'M', 'L', 'XL']",[],https://www.zara.com/es/es/pantalon-wide-fit-lyocell-p04717388.html,ZARA,PANTALÓN,HOMBRE
2024-05-19 18:45:21.614450,POLO PUNTO BOXY FIT,29.95,Polo de punto boxy fit tejido en hilatura con viscosa. Cuello solapa con abertura frontal. Manga corta. Bajo con aberturas laterales.,V2024-HOMBRE-TOTAL-LOOK,"['M', 'L', 'XL']",[],https://www.zara.com/es/es/polo-punto-boxy-fit-p04216413.html,ZARA,POLO,HOMBRE
2024-05-19 18:45:21.614450,BERMUDA PUNTO WIDE FIT,29.95,Bermuda wide fit. Cintura elástica ajustable con cordón. Bolsillos frontales.,V2024-HOMBRE-TOTAL-LOOK,"['M', 'L', 'XL']",[],https://www.zara.com/es/es/bermuda-punto-wide-fit-p04216414.html,ZARA,BERMUDA,HOMBRE
2024-05-19 18:45:21.614450,SOBRECAMISA 100% LINO,89.95,Sobrecamisa relaxed fit confeccionada en tejido de lino. Cuello solapa y manga larga acabada en puño con botón. Bolsillos de plastrón en delantero. Cierre frontal de botonadura.,V2024-HOMBRE-TOTAL-LOOK,"['S', 'M', 'L', 'XL']",[],https://www.zara.com/es/es/sobrecamisa-100-lino-p04768529.html,ZARA,SOBRECAMISA,HOMBRE
2024-05-19 18:45:21.614450,BERMUDA JACQUARD GEOMÉTRICO,25.95,Bermuda relaxed fit. Cintura elástica ajustable con cordón. Bolsillos frontales y detalle de bolsillo trasero de plastrón.,V2024-HOMBRE-TOTAL-LOOK,"['S', 'M', 'L', 'XL']",[],https://www.zara.com/es/es/bermuda-jacquard-geometrico-p05372412.html,ZARA,BERMUDA,HOMBRE
2024-05-19 18:45:21.614450,BERMUDA PUNTO ESTAMPADO TIE DYE,29.95,Bermuda de punto relaxed fit. Cintura elástica ajustable con cordón. Bolsillos laterales.,V2024-HOMBRE-TOTAL-LOOK,"['S', 'M', 'L', 'XL']",[],https://www.zara.com/es/es/bermuda-punto-estampado-tie-dye-p07140414.html,ZARA,BERMUDA,HOMBRE
2024-05-19 18:45:21.614450,CAMISA PUNTO ESTAMPADO TIE DYE,29.95,Camisa de punto relaxed fit. Cuello solapa y manga corta. Cierre frontal de botonadura.,V2024-HOMBRE-TOTAL-LOOK,"['S', 'M', 'L', 'XL']",[],https://www.zara.com/es/es/camisa-punto-estampado-tie-dye-p07140413.html,ZARA,CAMISA,HOMBRE
2024-05-19 18:45:21.614450,CAMISA JACQUARD GEOMÉTRICO,35.95,Camisa relaxed fit confeccionada en tejido con mezcla de algodón. Cuello solapa y manga corta. Bolsillos plastrón en pecho. Bajo con aberturas laterales. Cierre frontal de botonadura.,V2024-HOMBRE-TOTAL-LOOK,"['S', 'M', 'L', 'XL']",[],https://www.zara.com/es/es/camisa-jacquard-geometrico-p02675441.html,ZARA,CAMISA,HOMBRE
2024-05-19 18:45:21.614450,BERMUDA LAVADA BORDADO,25.95,Bermuda relaxed fit confeccionada en tejido de algodón. Cintura elástica ajustable con cordón. Bolsillos delanteros y detalle de bolsillos traseros de plastrón. Bajo acabado irregular.,V2024-HOMBRE-TOTAL-LOOK,"['S', 'M', 'L', 'XL']","['Blanco roto', 'Negro', 'Gris']",https://www.zara.com/es/es/bermuda-lavada-bordado-p04877310.html,ZARA,BERMUDA,HOMBRE
2024-05-19 18:45:21.614450,BERMUDA JACQUARD GEOMÉTRICO,29.95,Bermuda relaxed fit confeccionada en tejido con mezcla de algodón. Cintura elástica ajustable con cordón interior. Bolsillos laterales y detalle de bolsillo trasero de plastrón. Bajo con aberturas laterales.,V2024-HOMBRE-TOTAL-LOOK,"['S', 'M', 'L', 'XL']",[],https://www.zara.com/es/es/bermuda-jacquard-geometrico-p02675440.html,ZARA,BERMUDA,HOMBRE
2024-05-19 18:45:21.614450,CAMISA LAVADA BORDADO,29.95,Camisa relaxed fit confeccionada en tejido de algodón. Cuello solapa y manga corta. Bordado combinado a tono en delantero. Efecto lavado. Cierre frontal de botonadura.,V2024-HOMBRE-TOTAL-LOOK,"['S', 'M', 'L', 'XL']","['Negro', 'Blanco roto', 'Gris']",https://www.zara.com/es/es/camisa-lavada-bordado-p04877309.html,ZARA,CAMISA,HOMBRE
2024-05-19 18:45:51.455226,JEANS CARGO FLARED FIT,59.95,Jeans flared fit. Bolsillos de plastrón con solapa en cadera. Aplicación de bolsillos plastrón en perneras. Efecto lavado. Bajo ajustable con cremalleras. Cierre frontal con cremallera y botón cruzado.,V2024-HOMBRE-PANTALONES-CARGO-VER-TODO,"['38', '40', '42', '44']",[],https://www.zara.com/es/es/jeans-cargo-flared-fit-p06688411.html,ZARA,JEANS,HOMBRE
2024-05-19 18:45:51.455226,PANTALÓN PARACHUTE CARGO,29.95,Pantalón de cintura elástica ajustable. Bolsillos laterales y detalle de bolsillos de solapa en espalda. Aplicación de bolsillos plastrón con solapa en perneras. Pliegue en rodillas. Bajo ajustable con elástico en laterales.,V2024-HOMBRE-PANTALONES-CARGO-VER-TODO,"['S', 'M', 'L', 'XL']","['Negro', 'Verde / Azul']",https://www.zara.com/es/es/pantalon-parachute-cargo-p00108403.html,ZARA,PANTALÓN,HOMBRE
2024-05-19 18:45:51.455226,PANTALÓN CINTURA JOGGER CARGO,35.95,Pantalón cintura elástica ajustable con cordón interior. Bolsillos frontales y detalle de bolsillo trasero de plastrón. Aplicación de bolsillos plastrón con solapa en pernera. Bajo acabado en puño con elástico.,V2024-HOMBRE-PANTALONES-CARGO-VER-TODO,"['S', 'M', 'L', 'XL']","['Negro', 'Verde', 'Gris medio']",https://www.zara.com/es/es/pantalon-cintura-jogger-cargo-p03918460.html,ZARA,PANTALÓN,HOMBRE
2024-05-19 18:45:51.455226,JEANS CARGO CREMALLERAS,35.95,Jeans slim fit. Cinco bolsillos. Aplicación de bolsillos plastrón con solapa en perneras. Efecto lavado. Bajo ajustable con cremallera. Cierre frontal con cremallera y botón.,V2024-HOMBRE-PANTALONES-CARGO-VER-TODO,"['38', '40', '42', '44', '46']","['Negro', 'Carbón', 'Khaki']",https://www.zara.com/es/es/jeans-cargo-cremalleras-p04060444.html,ZARA,JEANS,HOMBRE
2024-05-19 18:45:51.455226,PANTALÓN STRAIGHT CARGO,39.95,Pantalón straight fit. Cintura elástica. Bolsillos laterales y detalle de bolsillos traseros. Aplicación de bolsillo plastrón con solapa en pernera. Cierre frontal con cremallera y botón.,V2024-HOMBRE-PANTALONES-CARGO-VER-TODO,"['S', 'M', 'L', 'XL']",[],https://www.zara.com/es/es/pantalon-straight-cargo-p05520404.html,ZARA,PANTALÓN,HOMBRE
2024-05-19 18:45:51.455226,JEANS CARGO DESMONTABLES,49.95,Jeans loose fit. Cintura ajustable con trabillas laterales. Cinco bolsillos. Aplicación de bolsillos plastrón con solapa en perneras. Perneras desmontables mediante cremallera oculta. Efecto lavado. Bajo ajustable con cremallera frontal. Cierre frontal con cremallera y botón.,V2024-HOMBRE-PANTALONES-CARGO-VER-TODO,"['36', '38', '40', '42', '44']",[],https://www.zara.com/es/es/jeans-cargo-desmontables-p08062411.html,ZARA,JEANS,HOMBRE
2024-05-19 18:45:51.455226,JEANS RELAXED CARGO,49.95,Jeans relaxed fit. Bolsillos delanteros y traseros de solapa. Aplicación de bolsillo plastrón con cierre de cremallera en pernera. Pespuntes combinados a contraste en toda la prenda. Cierre frontal con cremallera y botón.,V2024-HOMBRE-PANTALONES-CARGO-VER-TODO,"['36', '38', '40', '42', '44']",[],https://www.zara.com/es/es/jeans-relaxed-cargo-p00621401.html,ZARA,JEANS,HOMBRE
2024-05-19 18:45:51.455226,JEANS BOLSILLOS UTILITY,39.95,Jeans straight fit. Bolsillos frontales y detalle de bolsillos traseros de plastrón. Aplicación de bolsillos multifunción en perneras. Efecto lavado. Cierre frontal con cremallera y botón.,V2024-HOMBRE-PANTALONES-CARGO-VER-TODO,"['36', '38', '40', '42', '44', '46']","['Negro', 'Arena', 'Azul / Verde', 'Azul claro']",https://www.zara.com/es/es/jeans-bolsillos-utility-p01538414.html,ZARA,JEANS,HOMBRE
2024-05-19 18:45:51.455226,BERMUDA CARGO 100% LINO,29.95,Bermuda relaxed fit confeccionada en tejido de lino. Bolsillos laterales y detalle de bolsillos traseros de vivo. Aplicación de bolsillos plastrón en perneras. Cierre frontal con cremallera y botón.,V2024-HOMBRE-PANTALONES-CARGO-VER-TODO,"['S', 'M', 'L', 'XL']",[],https://www.zara.com/es/es/bermuda-cargo-100-lino-p04226708.html,ZARA,BERMUDA,HOMBRE
2024-05-19 18:45:51.455226,PANTALÓN CARGO ESTRUCTURA,39.95,Pantalón regular fit confeccionado en tejido con estructura. Bolsillos frontales y detalle de bolsillos traseros con solapa. Aplicación de bolsillos plastrón con solapa en perneras. Cierre frontal con cremallera y botón.,V2024-HOMBRE-PANTALONES-CARGO-VER-TODO,"['38', '40', '42', '44']",[],https://www.zara.com/es/es/pantalon-cargo-estructura-p06861406.html,ZARA,PANTALÓN,HOMBRE
2024-05-19 18:45:51.455226,PANTALÓN CARGO PANA,39.95,Pantalón relaxed fit. Cintura elástica ajustable con cordón interior. Bolsillos frontales y detalle de bolsillos traseros de vivo. Aplicación de bolsillos con solapa en perneras. Detalle de pliegues en rodillas. Bajo ajustable con cordón. Cierre frontal con cremallera y botón.,V2024-HOMBRE-PANTALONES-CARGO-VER-TODO,"['S', 'M', 'L', 'XL']",[],https://www.zara.com/es/es/pantalon-cargo-pana-p05520481.html,ZARA,PANTALÓN,HOMBRE
2024-05-19 18:45:51.455226,PANTALÓN PARACHUTE CARGO,29.95,Pantalón de cintura elástica ajustable. Bolsillos frontales y detalle de bolsillos de plastrón en espalda. Aplicación de bolsillos plastrón en delantero. Pliegue en rodillas. Bajo ajustable con elástico en laterales.,V2024-HOMBRE-PANTALONES-CARGO-VER-TODO,"['S', 'M', 'L', 'XL']","['Gris claro', 'Negro']",https://www.zara.com/es/es/pantalon-parachute-cargo-p00108404.html,ZARA,PANTALÓN,HOMBRE
2024-05-19 18:45:51.455226,PANTALÓN CARGO CINTURÓN,29.95,Pantalón relaxed fit confeccionado en tejido con algodón. Cintura con pliegues en delantero y detalle de cinturón del mismo tejido. Bolsillos frontales y detalle de bolsillos traseros de vivo. Aplicación de bolsillo plastrón en pernera. Cierre frontal con cremallera y botón.,V2024-HOMBRE-PANTALONES-CARGO-VER-TODO,"['38', '40', '42', '44']",[],https://www.zara.com/es/es/pantalon-cargo-cinturon-p05520410.html,ZARA,PANTALÓN,HOMBRE
2024-05-19 18:45:51.455226,BERMUDA DENIM CARGO,29.95,Bermuda relaxed fit. Cinco bolsillos. Aplicación de bolsillos plastrón con solapa en perneras. Efecto lavado. Cierre frontal con cremallera y botón.,V2024-HOMBRE-PANTALONES-CARGO-VER-TODO,"['38', '40', '42', '44', '46']","['Negro', 'Azul', 'Arena']",https://www.zara.com/es/es/bermuda-denim-cargo-p01538469.html,ZARA,BERMUDA,HOMBRE
2024-05-19 18:45:51.455226,PANTALÓN CARGO UTILITY,39.95,Pantalón relaxed fit. Bolsillos frontales y detalle de bolsillos traseros de plastrón. Aplicación de bolsillos de plastrón multifunción en perneras. Efecto lavado. Cierre frontal con cremallera y botón.,V2024-HOMBRE-PANTALONES-CARGO-VER-TODO,"['36', '38', '40', '42', '44']",[],https://www.zara.com/es/es/pantalon-cargo-utility-p05862481.html,ZARA,PANTALÓN,HOMBRE
2024-05-19 18:45:51.455226,PANTALON CARGO SOFT,39.95,Pantalón slim fit. Cintura elástica ajustable con cordón. Bolsillos frontales y detalle de bolsillo trasero de vivo. Aplicación de bolsillos de plastrón con solapa en perneras. Bajo acabado en puño con elástico.,V2024-HOMBRE-PANTALONES-CARGO-VER-TODO,"['S', 'M', 'L', 'XL']","['Beige', 'Negro', 'Khaki']",https://www.zara.com/es/es/pantalon-cargo-soft-p05862430.html,ZARA,PANTALON,HOMBRE
2024-05-19 18:45:51.455226,PANTALÓN CARGO CINTURÓN,35.95,Pantalón straight fit. Cintura con detalle de cinturón en el mismo tejido. Bolsillos frontales y detalle de bolsillos traseros de plastrón con solapa. Efecto lavado. Aplicación de bolsillos plastrón con solapa en perneras. Bajo acabado irregular. Cierre frontal con cremallera y botón.,V2024-HOMBRE-PANTALONES-CARGO-VER-TODO,"['38', '40', '42', '44', '46']",[],https://www.zara.com/es/es/pantalon-cargo-cinturon-p04877306.html,ZARA,PANTALÓN,HOMBRE
2024-05-19 18:45:51.455226,PANTALÓN BOLSILLOS UTILITY,49.95,Pantalón relaxed fit. Bolsillos frontales y detalle de bolsillos traseros con solapa. Aplicación de bolsillos multifunción en perneras. Bajo ajustable con elástico. Efecto lavado. Cierre frontal con cremallera y botón.,V2024-HOMBRE-PANTALONES-CARGO-VER-TODO,"['S', 'M', 'L', 'XL']",[],https://www.zara.com/es/es/pantalon-bolsillos-utility-p04877300.html,ZARA,PANTALÓN,HOMBRE
2024-05-19 18:45:51.455226,BERMUDA CARGO ESTRUCTURA TWILL,29.95,Bermuda relaxed fit confeccionada en tejido de algodón con elasticidad. Bolsillos frontales y detalle de bolsillos traseros de vivo. Aplicación de bolsillos plastrón con solapa en perneras. Cierre frontal con cremallera y botón.,V2024-HOMBRE-PANTALONES-CARGO-VER-TODO,"['38', '40', '42', '44', '46']","['Marino', 'Khaki']",https://www.zara.com/es/es/bermuda-cargo-estructura-twill-p06861727.html,ZARA,BERMUDA,HOMBRE
2024-05-19 18:46:28.057649,ORIGINS SNEAKER 001,69.95,Zapatilla deportiva tipo running. Fabricada en piel con combinación de otros materiales. Superposición de piezas en el corte. Cordonera con seis pasados. Suela con diseño irregular y algo de volumen.Disponible en varios colores. Edición limitada.,V2024-HOMBRE-ZAPATILLAS-VER-TODO,"['38', '39', '40', '41', '42', '43', '44', '45', '46', '47']","['Negro', 'Rojo Burdeos', 'Azul Oscuro', 'Verde Agua', 'Plata', 'Blanco', 'Multicolor', 'Beige Platino', 'Verde', 'Naranja', 'Marrón', 'Azul']",https://www.zara.com/es/es/origins-sneaker-001-p12399220.html,ZARA,ORIGINS,HOMBRE
2024-05-19 18:46:28.057649,ZAPATILLA SUELA VOLUMEN,35.95,Zapatilla deportiva. Detalle de pespuntes en el corte y pieza en la parte trasera. Cordonera con siete pasados. Cerco alrededor del corte. Piso con volumen.,V2024-HOMBRE-ZAPATILLAS-VER-TODO,"['39', '40', '41', '42', '43', '44', '45', '46', '47']","['Blanco', 'Negro']",https://www.zara.com/es/es/zapatilla-suela-volumen-p12219320.html,ZARA,ZAPATILLA,HOMBRE
2024-05-19 18:46:28.057649,ZAPATILLA SKATE CUERDAS,49.95,Zapatilla con cordones de cuerda. Combinación de piezas y materiales en el corte. Detalle de pespuntes a contraste. Tirador trasero para facilitar el calce. Piso con volumen y diseño irregular.,V2024-HOMBRE-ZAPATILLAS-VER-TODO,"['39', '40', '41', '42', '43', '44', '45']",[],https://www.zara.com/es/es/zapatilla-skate-cuerdas-p12245420.html,ZARA,ZAPATILLA,HOMBRE
2024-05-19 18:46:28.057649,ZAPATILLA PARA CORRER,39.95,"Zapatilla deportiva para correr. Parte superior fabricada en tejido técnico transpirable. Suela con tecnología Spume Foam V2 antideslizante que aporta amortiguación, flexibilidad y ligereza. Plantilla interior OrthoLite® extraíble. Zara Athleticz.",V2024-HOMBRE-ZAPATILLAS-VER-TODO,"['39', '40', '41', '42', '43', '44', '45', '46', '47']",[],https://www.zara.com/es/es/zapatilla-para-correr-p12333320.html,ZARA,ZAPATILLA,HOMBRE
2024-05-19 18:46:28.057649,ZAPATILLA PARA CORRER,39.95,Zapatilla deportiva para correr. Parte superior fabricada en tejido transpirable. Tirador en la parte posterior para facilitar el calce. Cordonera con seis pasados. Suela con tecnología Spume Foam V2 que garantiza ligereza y confort.Zara Athleticz.,V2024-HOMBRE-ZAPATILLAS-VER-TODO,"['39', '40', '41', '42', '43', '44', '45', '46', '47']","['Blanco Hueso', 'Azul', 'Negro']",https://www.zara.com/es/es/zapatilla-para-correr-p12330320.html,ZARA,ZAPATILLA,HOMBRE
2024-05-19 18:46:28.057649,ZAPATILLA BÁSICA,25.95,Zapatilla deportiva. Parte superior fabricada en combinación de piezas. Cordonera con siete pasados. Forro interior y plantilla a tono. Suela plana.,V2024-HOMBRE-ZAPATILLAS-VER-TODO,"['39', '40', '41', '42', '43', '44', '45', '46', '47']","['Blanco', 'Multicolor']",https://www.zara.com/es/es/zapatilla-basica-p12250320.html,ZARA,ZAPATILLA,HOMBRE
2024-05-19 18:46:28.057649,ZAPATILLA MULTIPIEZAS,35.95,Zapatilla deportiva. Parte superior fabricada en combinación de piezas y materiales. Cordonera con seis pasados. Horma Redonda. Tecnología Stabi-Pro en el talón para mayor soporte. Plantilla interior acolchada Spume Foam. Suela con detalle a contraste. Zara Athleticz.,V2024-HOMBRE-ZAPATILLAS-VER-TODO,"['39', '40', '41', '42', '43', '44', '45']","['Negro', 'Blanco']",https://www.zara.com/es/es/zapatilla-multipiezas-p12212320.html,ZARA,ZAPATILLA,HOMBRE
2024-05-19 18:46:28.057649,ZAPATILLA PIEL SUELA CONTRASTE,39.95,Zapatilla deportiva. Parte superior fabricada en piel lisa con detalle de serraje en la punta. Cordonera con siete pasados. Suela a contraste. Estilo retro.,V2024-HOMBRE-ZAPATILLAS-VER-TODO,"['39', '40', '41', '42', '43', '44', '45', '46', '47']",[],https://www.zara.com/es/es/zapatilla-piel-suela-contraste-p12281320.html,ZARA,ZAPATILLA,HOMBRE
2024-05-19 18:46:28.057649,ZAPATILLA BÁSICA,25.95,Zapatilla deportiva. Parte superior fabricada en combinación de piezas. Cordonera con siete pasados. Forro interior y plantilla a contraste. Suela plana.,V2024-HOMBRE-ZAPATILLAS-VER-TODO,"['39', '40', '41', '42', '43', '44', '45', '46', '47']","['Blanco', 'Gris', 'Azul', 'Negro', 'Verde agua']",https://www.zara.com/es/es/zapatilla-basica-p12204320.html,ZARA,ZAPATILLA,HOMBRE
2024-05-19 18:46:28.057649,ZAPATILLA PARA SENDERISMO,59.95,Zapatilla deportiva para senderismo. Parte superior fabricada en tejido transpirable. Cordonera ajustable. Tecnología Stabi-pro para dar estabilidad a la pisada. Suela ligera dentada.Zara Athleticz.,V2024-HOMBRE-ZAPATILLAS-VER-TODO,"['39', '40', '41', '42', '43', '44', '45']","['Blanco Hueso', 'Negro']",https://www.zara.com/es/es/zapatilla-para-senderismo-p12382220.html,ZARA,ZAPATILLA,HOMBRE
2024-05-19 18:46:28.057649,ZAPATILLA PARA CORRER,35.95,Zapatilla deportiva para correr. Parte superior tipo calcetín fabricada en tejido transpirable. Tirador en la parte posterior para facilitar el calce. Suela con tecnología Spume Foam V2 que garantiza ligereza y confort.Zara Athleticz.,V2024-HOMBRE-ZAPATILLAS-VER-TODO,"['39', '40', '41', '42', '43', '44', '45', '46', '47']",[],https://www.zara.com/es/es/zapatilla-para-correr-p12310420.html,ZARA,ZAPATILLA,HOMBRE
2024-05-19 18:46:28.057649,ZAPATILLA RUNNING KNIT,29.95,Zapatilla deportiva tipo running. Parte superior tipo calcetín fabricada en tejido transpirable. Plantilla interior extraíble. Piso con tecnología Spume Foam que garantiza ligereza y confort. Suela dentada.Zara Athleticz.,V2024-HOMBRE-ZAPATILLAS-VER-TODO,"['39', '40', '41', '42', '43', '44', '45']",[],https://www.zara.com/es/es/zapatilla-running-knit-p12311320.html,ZARA,ZAPATILLA,HOMBRE
2024-05-19 18:46:28.057649,ZAPATILLA RUNNING KNIT,69.95,Zapatilla deportiva tipo running. Parte superior fabricada en tejido transpirable. Cordonera con seis pasados que se ajustan gracias a una pieza técnica. Plantilla interior extraíble. Piso con tecnología Bright Foam que garantiza ligereza y confort.Zara Athleticz.,V2024-HOMBRE-ZAPATILLAS-VER-TODO,"['39', '40', '41', '42', '43', '44', '45']",[],https://www.zara.com/es/es/zapatilla-running-knit-p12320220.html,ZARA,ZAPATILLA,HOMBRE
2024-05-19 18:46:28.057649,ZAPATILLA SUELA VOLUMEN,29.95,Zapatilla deportiva. Combinación de materiales y colores en el corte. Cordonera con siete pasados. Cuenta con una pieza a contraste de color en la parte trasera. Suela con volumen de diseño irregular.,V2024-HOMBRE-ZAPATILLAS-VER-TODO,"['39', '40', '41', '42', '43', '44', '45', '46', '47']","['Blanco', 'Negro']",https://www.zara.com/es/es/zapatilla-suela-volumen-p12200320.html,ZARA,ZAPATILLA,HOMBRE
2024-05-19 18:46:28.057649,ZAPATILLA DETALLE TALÓN,35.95,Zapatilla deportiva. Parte superior lisa con detalle de piezas a contraste en el talón. Cordonera con seis pasados. Suela con volumen y diseño irregular.,V2024-HOMBRE-ZAPATILLAS-VER-TODO,"['39', '40', '41', '42', '43', '44', '45', '46', '47']",[],https://www.zara.com/es/es/zapatilla-detalle-talon-p12226320.html,ZARA,ZAPATILLA,HOMBRE
2024-05-19 18:46:28.057649,ZAPATILLA MONOCOLOR,29.95,Zapatilla deportiva. Parte superior fabricada en combinación de piezas. Cordonera con siete pasados. Forro interior y plantilla a tono. Piso ligero con volumen.,V2024-HOMBRE-ZAPATILLAS-VER-TODO,"['39', '40', '41', '42', '43', '44', '45', '46', '47']","['Blanco', 'Negro', 'ARENA/MARRÓN']",https://www.zara.com/es/es/zapatilla-monocolor-p12209320.html,ZARA,ZAPATILLA,HOMBRE
